{
  "schemaVersion": 1,
  "id": "test-close",
  "name": "测试贴贴",
  "relativeSize": 0.8,
  "personality": {
    "activity": 0.4,
    "clinginess": 0.9,
    "initiative": 0.3,
    "dominance": 0.1,
    "patience": 0.7
  },
  "relationships": [
    { "cat": "test-calm", "closeness": 0.8, "dominance": 0.3 },
    { "cat": "test-active", "closeness": 0.8, "dominance": -0.3 }
  ],
  "sounds": { "meow": [], "purr": [] }
}
